{
  "benchmark_schema_version": 1,
  "case_sha256": "f1bcb78405283dd6f92802ad4c39a1df3f016256357938fcda0cf74e8beb48ec",
  "trial_id": "example-swarm-001",
  "pair_id": "pair-001",
  "arm": "swarm",
  "replicate": 1,
  "order": "AB",
  "warmup": false,
  "host_profile_sha256": "6666666666666666666666666666666666666666666666666666666666666666",
  "routing_status": "host_selected",
  "duration_ns": 6250000000,
  "timing_source": "illustrative monotonic timing receipt",
  "terminal_status": "SUCCEEDED",
  "acceptance_passed": true,
  "gate_sha256": "4444444444444444444444444444444444444444444444444444444444444444",
  "artifact_sha256": "dddddddddddddddddddddddddddddddddddddddddddddddddddddddddddddddd",
  "requested_parallel": 3,
  "scheduler_issued_peak": 3,
  "observed_peak": null,
  "telemetry_sha256": null,
  "usage": {
    "input_tokens": null,
    "output_tokens": null,
    "credits": null,
    "source": null
  },
  "unknowns": 0,
  "retries": 0,
  "exclusion_reason": null,
  "evidence": {
    "ledger": "eeeeeeeeeeeeeeeeeeeeeeeeeeeeeeeeeeeeeeeeeeeeeeeeeeeeeeeeeeeeeeee",
    "journal": "ffffffffffffffffffffffffffffffffffffffffffffffffffffffffffffffff",
    "doctor": "1212121212121212121212121212121212121212121212121212121212121212",
    "gate_log": "1313131313131313131313131313131313131313131313131313131313131313",
    "timing": "1414141414141414141414141414141414141414141414141414141414141414"
  }
}
